{
  "$schema": "../../schemas/capability-audit.v1.schema.json",
  "format": "honua.release-capability-audit.v1",
  "schemaVersion": "1.0.0",
  "auditId": "ogc-process-lifecycle-preview",
  "auditSet": "2026-08-08",
  "title": "OGC process job lifecycle preview",
  "capabilityKey": "process.ogc-api-processes",
  "jobId": "job.ogc-process-lifecycle",
  "claim": {
    "gaClaim": false,
    "summary": "Submit, observe, obtain results, and cancel/dismiss an OGC process job without claiming cross-SDK GA parity.",
    "scope": [
      "Submit/poll/results/cancel lifecycle",
      "JS bounded wait/watch",
      "Python source-preview lifecycle",
      ".NET source-preview lifecycle"
    ],
    "exclusions": [
      "GA",
      "Full OGC dismiss conformance",
      ".NET bounded waiter",
      "CLI process/job commands"
    ],
    "publicClaims": [
      {
        "source": "honua-server capability matrix 61b7038e1887c98131aa217b6f0ae7869356a1f3",
        "status": "implemented-count-derived",
        "text": "process.ogc-api-processes has source/test entries; the matrix explicitly says this is not a GA signoff."
      },
      {
        "source": "honua-site capabilities 718350adafbb519cd1bf8004b5f1014b45eebba9",
        "status": "source-backed",
        "text": "process.ogc-api-processes is published as source-backed without an immutable release artifact."
      }
    ]
  },
  "targetTier": "preview",
  "owner": {
    "team": "Developer Experience / Release Engineering",
    "repository": "honua-io/honua-samples",
    "contact": "release owner pending signoff"
  },
  "protocol": {
    "names": [
      "OGC API Processes"
    ],
    "versions": [
      "Core lifecycle; exact release profile not pinned"
    ],
    "endpoints": [
      "/ogc/processes",
      "/ogc/processes/{processId}/execution",
      "/ogc/jobs/{jobId}",
      "/ogc/jobs/{jobId}/results"
    ]
  },
  "server": {
    "repository": "honua-io/honua-server",
    "commit": "61b7038e1887c98131aa217b6f0ae7869356a1f3",
    "image": {
      "reference": null,
      "digest": null,
      "status": "missing"
    },
    "conformance": [
      "Core job lifecycle exists in source; DELETE is best-effort cancellation, not full dismiss conformance."
    ],
    "limits": [
      "Release-bound timeout/retry limits not attached."
    ],
    "errors": [
      "SDK typed errors differ by language."
    ],
    "security": [
      "Release-bound security receipt missing."
    ],
    "performance": [
      "No release job latency/queue receipt."
    ],
    "observability": [
      "Release-bound trace/metric/log receipt missing."
    ]
  },
  "clients": {
    "javascript": {
      "status": "beta",
      "package": {
        "name": "@honua/sdk-js",
        "declaredVersion": "0.1.4-beta.0",
        "publishedVersion": "0.1.2-beta.0",
        "sourceCommit": "e0b4c21cfa17808a01f80d095c4ca5e9cda6b835"
      },
      "symbols": [
        "HonuaClient.ogcProcesses().execute",
        "IJobRun.poll",
        "IJobRun.watch",
        "IJobRun.results",
        "IJobRun.cancel"
      ],
      "evidence": [
        "honua-sdk-js source"
      ],
      "exclusion": null
    },
    "python": {
      "status": "source-preview",
      "package": {
        "name": "honua-sdk",
        "declaredVersion": "0.1.10",
        "publishedVersion": null,
        "sourceCommit": "e28c67c8e3ef99bcc86c891ecc01a6940d7d7e59"
      },
      "symbols": [
        "HonuaClient.geoprocessing().submit_inputs",
        "wait",
        "results",
        "dismiss"
      ],
      "evidence": [
        "compatibility/sdk-coverage.v1.json"
      ],
      "exclusion": null
    },
    "dotnet": {
      "status": "source-preview",
      "package": {
        "name": "Honua.Sdk",
        "declaredVersion": "1.6.0",
        "publishedVersion": null,
        "sourceCommit": "a88a7fbb3643cb046e70d6ef4d38ae70a025a2a4"
      },
      "symbols": [
        "IHonuaProcessesClient.SubmitJobAsync",
        "GetJobAsync",
        "GetJobResultsAsync",
        "DismissJobAsync"
      ],
      "evidence": [
        "Honua.Sdk.Processes 1.6.0"
      ],
      "exclusion": "No bounded wait helper; callers loop."
    },
    "cli": {
      "status": "absent",
      "package": {
        "name": "@honua/sdk-js",
        "declaredVersion": "0.1.4-beta.0",
        "publishedVersion": "0.1.2-beta.0",
        "sourceCommit": "e0b4c21cfa17808a01f80d095c4ca5e9cda6b835"
      },
      "symbols": [],
      "evidence": [
        "JS/Python/.NET CLI inventories"
      ],
      "exclusion": "No process/job command was found."
    }
  },
  "demo": {
    "manifestServiceKey": null,
    "manifestProtocolKey": null,
    "manifestCommit": "3cccf9b08a19e51619a0e6bec19b0e2afbb5ebde",
    "liveCanary": {
      "status": "missing",
      "route": null,
      "evidenceId": null
    },
    "reset": {
      "status": "missing",
      "procedure": null,
      "owner": "Demo Operations (receipt unassigned)"
    }
  },
  "experience": {
    "exampleRoutes": [],
    "walkthroughRoutes": [
      "honua-samples issue #29 source/evidence contract"
    ],
    "projectRoutes": [
      "honua-sdk-js/examples/geoprocessing-job-runner"
    ]
  },
  "evidence": {
    "freshnessPolicy": {
      "asOf": "2026-08-08T00:00:00Z",
      "defaultTtlDays": 14
    },
    "required": [
      "sdk-supported-surface",
      "fixture-semantic",
      "live-semantic",
      "compatibility-support"
    ],
    "receipts": [
      {
        "id": "server-matrix",
        "kind": "source-inventory",
        "source": "https://github.com/honua-io/honua-server/blob/61b7038e1887c98131aa217b6f0ae7869356a1f3/docs/gis/data/capability-matrix.v1.json",
        "capturedAt": "2026-08-05T18:38:08Z",
        "expiresAt": "2026-09-04T18:38:08Z",
        "digest": {
          "algorithm": "git-blob-sha1",
          "value": "200a3f61ad467b0b98f48d39a9813460a3634cc2"
        },
        "semanticAssertions": [
          "process.ogc-api-processes is present in the canonical matrix.",
          "Source lifecycle present; cross-SDK semantic receipt absent",
          "Implemented counts are not a GA signoff."
        ]
      }
    ],
    "missing": [
      {
        "kind": "sdk-supported-surface",
        "reason": "Published packages do not form the claimed support window.",
        "gapId": "JOB-001"
      },
      {
        "kind": "fixture-semantic",
        "reason": "No digest-pinned fixture semantic receipt is admitted.",
        "gapId": "JOB-001"
      },
      {
        "kind": "live-semantic",
        "reason": "No fresh Honua-candidate semantic receipt is attached.",
        "gapId": "JOB-001"
      },
      {
        "kind": "compatibility-support",
        "reason": "No published compatibility/deprecation/support window covers the claim.",
        "gapId": "JOB-001"
      }
    ]
  },
  "accessibility": {
    "status": "not-applicable",
    "evidenceIds": [],
    "targets": [
      "API/headless job"
    ],
    "note": "No UI claim."
  },
  "browserPlatform": {
    "status": "missing",
    "evidenceIds": [],
    "targets": [
      "Chromium",
      "Firefox",
      "WebKit",
      "desktop",
      "mobile"
    ],
    "note": "Release-bound browser/platform evidence is missing."
  },
  "documentation": {
    "references": [
      "honua-samples issue #29",
      "honua-sdk-python issue #192"
    ],
    "troubleshooting": [],
    "status": "missing"
  },
  "compatibility": {
    "policy": "No cross-repository GA compatibility window is published for this exact claim.",
    "deprecation": "Producer repositories retain prerelease/source policies.",
    "support": "Evaluation only until this dossier passes."
  },
  "operations": {
    "rollbackProcedure": null,
    "rollbackOwner": "unassigned",
    "incidentOwner": "Honua release incident commander (assignment pending)"
  },
  "blockers": [
    {
      "gapId": "JOB-001",
      "evidenceKinds": [
        "sdk-supported-surface",
        "fixture-semantic",
        "live-semantic",
        "compatibility-support"
      ],
      "note": "Normalize OGC process lifecycle semantics across SDKs",
      "issue": "https://github.com/honua-io/honua-samples/pull/29"
    }
  ],
  "signoffs": [
    {
      "role": "capability-owner",
      "owner": "unassigned",
      "status": "pending",
      "signedAt": null
    },
    {
      "role": "security",
      "owner": "unassigned",
      "status": "pending",
      "signedAt": null
    },
    {
      "role": "release",
      "owner": "unassigned",
      "status": "pending",
      "signedAt": null
    },
    {
      "role": "support",
      "owner": "unassigned",
      "status": "pending",
      "signedAt": null
    }
  ],
  "expiry": "2026-09-07T00:00:00Z",
  "decision": "conditional"
}
